,,,Document Number,Book Type/Roll/Frame,Grantor,Grantee,Doc Type,Recorded Date,Square,Lot,Related Instrument Number,,,,Document Number,Book Type/Roll/Frame,Grantor,Grantee,Doc Type,Recorded Date,Square,Lot,Related Instrument Number
,,,2024097674,OPR/--/--,AUTOGEM INVICTA LIMITED,WELLS FARGO BANK, NATIONAL ASSOCIATION,FINANCING STATEMENT,10/17/2024,N/A,N/A,N/A
,,,2024091486,OPR/--/--,AUTOMOTIVE COMFORT SYSTEMS S. DE R. L. DE C.V.,JPMORGAN CHASE BANK, N.A.,FINANCING STATEMENT,9/27/2024,N/A,N/A,N/A
,,,2024082793,OPR/--/--,AUTOMOTIVE FINANCE CANADA INC,AUTOBOYZ FINE CARS INC.,FINANCING STATEMENT TERMINATION,9/3/2024,N/A,N/A,2022082840
,,,2024085322,OPR/--/--,AUTOMOTIVE FINANCE CANADA INC,CANADIAN FINANCING & LEASING SERVICES LTD.,FINANCING STATEMENT TERMINATION,9/10/2024,N/A,N/A,2023085775
,,,2024085337,OPR/--/--,AUTOMOTIVE FINANCE CANADA INC,NORTH AMERICAN WHOLESALE LLC,FINANCING STATEMENT TERMINATION,9/10/2024,N/A,N/A,2023061710
,,,2024085346,OPR/--/--,AUTOMOTIVE FINANCE CANADA INC.,BODAFIDE AUTO LTD.,FINANCING STATEMENT TERMINATION,9/10/2024,N/A,N/A,2018095383
,,,2024091003,OPR/--/--,AVANTI REAL ESTATE SERVICES, INC,AVANTI REAL ESTATE SERVICES, LLC,DEED,9/26/2024,2836,0123,N/A
,,,2024095122,OPR/--/--,AVIANCA COSTA RICA S.A.,J.P. MORGAN EUROPE LIMITED,FINANCING STATEMENT CONTINUATION,10/9/2024,N/A,N/A,2020027517
,,,2024095318,OPR/--/--,TACA INTERNATIONAL AIRLINES, S.A.,BANK OF UTAH,FINANCING STATEMENT,10/9/2024,N/A,N/A,N/A
,,,2024094663,OPR/--/--,AVIATOR V 2751,UMB BANK, N.A.,FINANCING STATEMENT AMENDMENT,10/8/2024,N/A,N/A,2024089698
,,,2024089698,OPR/--/--,AVIATOR V 2751, DESIGNATED ACTIVITY COMPANY,UMB BANK, N.A.,FINANCING STATEMENT,9/23/2024,N/A,N/A,2024094663
,,,2024100510,OPR/--/--,AVIATOR V 4106, DESIGNATED ACTIVITY COMPANY,UMB BANK, N.A.,FINANCING STATEMENT,10/25/2024,N/A,N/A,N/A
,,,2024100511,OPR/--/--,AVIATOR V 4145, DESIGNATED ACTIVITY COMPANY,UMB BANK, N.A.,FINANCING STATEMENT,10/25/2024,N/A,N/A,N/A
,,,2024091820,OPR/--/--,AVRAMOV KONSTANTIN,WATERS DAVID E,TRUST,9/30/2024,3833,0088,N/A
,,,2024093469,OPR/--/--,AVISTA CAPITAL PARTNERS (OFFSHORE) V, L.P.,BMO HARRIS BANK N.A.,FINANCING STATEMENT AMENDMENT,10/2/2024,N/A,N/A,2022092233
,,,2024093478,OPR/--/--,AVISTA CAPITAL PARTNERS (OFFSHORE) V, L.P.,BMO HARRIS BANK N.A.,FINANCING STATEMENT AMENDMENT,10/2/2024,N/A,N/A,2022092193
,,,2024094438,OPR/--/--,AVISTA HEALTHCARE PARTNERS (OFFSHORE) II, L.P.,BMO BANK N.A.,FINANCING STATEMENT AMENDMENT,10/8/2024,N/A,N/A,2022092193
,,,2024094456,OPR/--/--,AVISTA CAPITAL PARTNERS (OFFSHORE) V, L.P.,BMO BANK N.A.,FINANCING STATEMENT AMENDMENT,10/8/2024,N/A,N/A,2022092233
,,,2024094466,OPR/--/--,AVISTA HEALTHCARE PARTNERS (OFFSHORE) II, L.P.,BMO BANK N.A.,FINANCING STATEMENT AMENDMENT,10/8/2024,N/A,N/A,2022092233
,,,2024094453,OPR/--/--,AVISTA HEALTHCARE PARTNERS (OFFSHORE) II, L.P.,BMO BANK, N.A.,FINANCING STATEMENT AMENDMENT,10/8/2024,N/A,N/A,2022092193
,,,2024092613,OPR/--/--,AVISTA HEALTHCARE PARTNERS (OFFSHORE) III, L.P.,BMO BANK N.A.,FINANCING STATEMENT AMENDMENT,10/1/2024,N/A,N/A,2022060307
,,,2024087545,OPR/--/--,AVISTA HEALTHCARE PARTNERS (OFFSHORE) VI, L.P.,BMO BANK N.A.,FINANCING STATEMENT AMENDMENT,9/17/2024,N/A,N/A,2022060307
,,,2024087797,OPR/--/--,AVL EUROPE, LTD.,CITY NATIONAL BANK,FINANCING STATEMENT CONTINUATION,9/18/2024,N/A,N/A,2020029209
,,,2024098126,OPR/--/--,AVOCALI S DE RL DE CV,CF TRADE, LLC,FINANCING STATEMENT,10/18/2024,N/A,N/A,N/A
,,,2024094359,OPR/--/--,AVOLON LEASING IRELAND 1 LIMITED,MORGAN STANLEY SENIOR FUNDING, INC.,FINANCING STATEMENT AMENDMENT,10/8/2024,N/A,N/A,2024066198
,,,2024096910,OPR/--/--,AVOLON LEASING IRELAND 3 LIMITED,MORGAN STANLEY SENIOR FUNDING, INC.,FINANCING STATEMENT AMENDMENT,10/15/2024,N/A,N/A,2018122608
,,,2024096225,OPR/--/--,AVRIETTE MARY CAROLYN,TANGNEY PATRICK J,TRUST,10/11/2024,3522,0035,2024049821
,,,2024086179,OPR/--/--,Murray Miriam,Modesti Liam Phillip,DEED,9/12/2024,0070,0191,N/A
,,,2024083980,OPR/--/--,AWBURY INSURANCE LTD.,BNP PARIBAS,FINANCING STATEMENT CONTINUATION,9/5/2024,N/A,N/A,2014118599
,,,2024082857,OPR/--/--,AWEKE TESHAGER,U.S. SMALL BUSINESS ADMINISTRATION,FINANCING STATEMENT,9/3/2024,N/A,N/A,N/A
,,,2024084356,OPR/--/--,AWOFODU SIMISOLA,C.L.A. TITLE & ESCROW,TRUST,9/6/2024,0617,0210,N/A
,,,2024100508,OPR/--/--,AXELSON, WILLIAMOWSKY, BENDER & FISHMAN PC,SHINOK PARK,JUDGMENT,10/25/2024,NA,NA,N/A
,,,2024082815,OPR/--/--,AXONIC COMMERCIAL REAL ESTATE FUND GP III LLC,Barings Finance LLC,FINANCING STATEMENT,9/3/2024,N/A,N/A,2024083629
,,,2024091193,OPR/--/--,AXOS BANK,ROBINSON MALCOLM R,CERTIFICATE OF SATISFACTION,9/26/2024,5172,0056,2017069958
,,,2024094818,OPR/--/--,AXOS BANK,Sastian LLC,CERTIFICATE OF SATISFACTION,10/8/2024,1427,0034,2019105490
,,,2024099388,OPR/--/--,BLITZ F24-476 GMBH,GLAS TRUST CORPORATION LIMITED,FINANCING STATEMENT AMENDMENT,10/22/2024,N/A,N/A,2024094361
,,,2024099389,OPR/--/--,CLUNA S.R.O.,GLAS TRUST CORPORATION LIMITED,FINANCING STATEMENT AMENDMENT,10/22/2024,N/A,N/A,2024094362
,,,2024101690,OPR/--/--,AYERS CAPRICE,HILTON RESORTS CORPORATION,DEED,10/29/2024,0050,2002,N/A
,,,2024083917,OPR/--/--,AYERS LINDSAY CATHERINE,JPMORGAN CHASE BANK NA,TRUST,9/5/2024,0273,2085,N/A
,,,2024085533,OPR/--/--,AYOFEMI OLAIDE A,FIDELITY NATIONAL TITLE INSURANCE,TRUST,9/11/2024,5304,0810,N/A
,,,2024100479,OPR/--/--,WILMINGTON TRUST SP SERVICES (DUBLIN) LIMITED,CITIBANK, N.A.,FINANCING STATEMENT,10/25/2024,N/A,N/A,2024102558
,,,2024102558,OPR/--/--,WILMINGTON TRUST SP SERVICES (DUBLIN) LIMITED,CITIBANK, N.A.,FINANCING STATEMENT AMENDMENT,10/31/2024,N/A,N/A,2024100479
,,,2024091777,OPR/--/--,AZORRA - SCOOT TRUST NO. 3,BANK OF UTAH,FINANCING STATEMENT,9/27/2024,N/A,N/A,N/A
,,,2024097765,OPR/--/--,AZORRA - SCOOT TRUST NO. 4,BANK OF UTAH,FINANCING STATEMENT,10/17/2024,N/A,N/A,N/A
,,,2024097194,OPR/--/--,AZORRA AICRAFT IRELAND 3 LIMITED,UMB BANK, NATIONAL ASSOCIATION,FINANCING STATEMENT,10/16/2024,N/A,N/A,N/A
