,,,Document Number,Book Type/Roll/Frame,Grantor,Grantee,Doc Type,Recorded Date,Square,Lot,Related Instrument Number,,,,Document Number,Book Type/Roll/Frame,Grantor,Grantee,Doc Type,Recorded Date,Square,Lot,Related Instrument Number
,,,2024100523,OPR/--/--,ARKELA ASSETS S.A.,BANC OF AMERICA LEASING & CAPITAL, LLC,FINANCING STATEMENT CONTINUATION,10/25/2024,N/A,N/A,2019141754
,,,2024098431,OPR/--/--,ARKTX, PC,SUNTRUST BANK,FINANCING STATEMENT CONTINUATION,10/21/2024,N/A,N/A,2005053829
,,,2024100567,OPR/--/--,ARLINGTON COMMUNITY FEDERAL CREDIT UNION,NATEN DEREK L,RELEASE,10/25/2024,0924,0028,N/A
,,,2024100564,OPR/--/--,ARLINGTON COMMUNITY FEDERAL CREDIT UNION,Sanders Betty S,CERTIFICATE OF SATISFACTION,10/25/2024,5363,0170,2022113804
,,,2024089847,OPR/--/--,ARMATURE WORKS (HOTEL) OWNER, LLC,SANTANDER BANK, N.A.,FINANCING STATEMENT CONTINUATION,9/23/2024,N/A,N/A,2020036668
,,,2024098919,OPR/--/--,ARMBRUSTER WILLIAM,GRAND VACATIONS TITLE, LLC,TRUST,10/22/2024,0050,2002,N/A
,,,2024083778,OPR/--/--,ARMED FORCES BANK N.A.,BELK LERAY,CERTIFICATE OF SATISFACTION,9/5/2024,3398,0004,2023106944
,,,2024090870,OPR/--/--,LUIS A ARNAL AND ELVIRA ARNAL LIVING TRUST,ARNAL ELVIRA,DEED,9/26/2024,1299,2047,N/A
,,,2024090871,OPR/--/--,ARNAL ELVIRA,THE ELVIRA ARNAL SURVIVOR'S TRUST,DEED,9/26/2024,1299,2047,N/A
,,,2024098439,OPR/--/--,ARNO FRIEDRICHS HARTMETALL GMBH & CO. KG,NORDDEUTSCHE LANDESBANK GIROZENTRALE,FINANCING STATEMENT,10/21/2024,N/A,N/A,N/A
,,,2024102505,OPR/--/--,ARNOLD CURTIS JOHN,ZIEGLER WILLIAM J,TRUST,10/31/2024,S1308,0075,N/A
,,,2024094123,OPR/--/--,OSTROVSKY Alexander,Toler Scott,TRUST,10/4/2024,3295,0009,N/A
,,,2024082399,OPR/--/--,ARNOLD RICHARD,ARC CAPITAL HOLDINGS LLC,FINANCING STATEMENT,9/3/2024,N/A,N/A,N/A
,,,2024102603,OPR/--/--,ARNSDORF ISAAC,OLD REPUBLIC NATIONAL TITLE INSURANCE COMPANY,TRUST,10/31/2024,1893,0006,N/A
,,,2024100560,OPR/--/--,AROFLO INNOVATIONS PTY LTD,MACQUARIE PF SERVICES LLC,FINANCING STATEMENT,10/25/2024,N/A,N/A,N/A
,,,2024094568,OPR/--/--,ARONSON SAMUEL LEONARD,NADER JAMES,TRUST,10/8/2024,2567,0075,N/A
,,,2024098219,OPR/--/--,AROZ JASON,WATERS DAVID E,TRUST,10/18/2024,P0035,0340,N/A
,,,2024089946,OPR/--/--,ARRINGTON VICTORIA ANGELIQUE,WESTCOR LAND TITLE INSURANCE COMPANY,TRUST,9/23/2024,2234,2200,N/A
,,,2024101152,OPR/--/--,ARROWPOINT MASTER FUND,J.P. MORGAN SECURITIES LLC,FINANCING STATEMENT,10/28/2024,N/A,N/A,N/A
,,,2024086099,OPR/--/--,ARTES GRAFICAS SENEFELDER C.A.,CITIBANK EUROPE PLC,FINANCING STATEMENT,9/12/2024,N/A,N/A,N/A
,,,2024100747,OPR/--/--,GRAHAM DAVID,CMAP GLOBAL LIMITED,FINANCING STATEMENT TERMINATION,10/25/2024,N/A,N/A,2020009045
,,,2024099554,OPR/--/--,ARTICULOS METALICOS DE CADEREYTA, S.A. DE C.V.,JPMorgan Chase,FINANCING STATEMENT CONTINUATION,10/23/2024,N/A,N/A,2020041227
,,,2024094812,OPR/--/--,ARTISTA ASSOCIATES,INTERNATIONAL ART FINANCE, L.P.,FINANCING STATEMENT AMENDMENT,10/8/2024,N/A,N/A,2024044092
,,,2024090356,OPR/--/--,ARTUS LIMITED,J.P. MORGAN SE, LUXEMBOURG BRANCH,FINANCING STATEMENT AMENDMENT,9/25/2024,N/A,N/A,2023076576
,,,2024096180,OPR/--/--,ARTZ ANDREW DAVID,HOLMES MANUS,TRUST,10/11/2024,4537,0066,N/A
,,,2024096181,OPR/--/--,ARTZ ANDREW DAVID,HOLMES MANUS,TRUST,10/11/2024,4537,0066,N/A
,,,2024097586,OPR/--/--,ARTZ MICHAEL L,CLEVELAND VAUN B,DEED,10/17/2024,5801,0282,N/A
,,,2024084769,OPR/--/--,ARVANAGHI BABAK,PUTTA JHANSI R,DEED,9/9/2024,E1264,2045,N/A
,,,2024091080,OPR/--/--,MORTGAGE ELECTRONIC REGISTRATION SYSTEMS, INC.,RUPP JANA,CERTIFICATE OF SATISFACTION,9/26/2024,1665,2039,2020159929
,,,2024084282,OPR/--/--,AS AIR LEASE 187 (IRELAND) LIMITED,UMB BANK, NATIONAL ASSOCIATION,FINANCING STATEMENT,9/6/2024,N/A,N/A,N/A
,,,2024091514,OPR/--/--,AS AIR LEASE 189 (IRELAND) LIMITED,UMB BANK, NATIONAL ASSOCIATION,FINANCING STATEMENT,9/27/2024,N/A,N/A,N/A
,,,2024087045,OPR/--/--,AS AIR LEASE XXIII (SWEDEN) AB,UMB BANK, NATIONAL ASSOCIATION,FINANCING STATEMENT,9/16/2024,N/A,N/A,N/A
,,,2024097051,OPR/--/--,AS MILEAGE PLAN HOLDINGS LTD.,U.S. BANK TRUST COMPANY, NATIONAL ASSOCIATION,FINANCING STATEMENT,10/15/2024,N/A,N/A,N/A
,,,2024097048,OPR/--/--,AS MILEAGE PLAN HOLDINGS LTD.,U.S. BANK TRUST COMPANY, NATIONAL ASSOCIATION,FINANCING STATEMENT,10/15/2024,N/A,N/A,N/A
,,,2024097047,OPR/--/--,AS MILEAGE PLAN HOLDINGS LTD.,U.S. BANK TRUST COMPANY, NATIONAL ASSOCIATION,FINANCING STATEMENT,10/15/2024,N/A,N/A,N/A
,,,2024097046,OPR/--/--,AS MILEAGE PLAN IP LTD.,U.S. BANK TRUST COMPANY, NATIONAL ASSOCIATION,FINANCING STATEMENT,10/15/2024,N/A,N/A,N/A
,,,2024097049,OPR/--/--,AS MILEAGE PLAN IP LTD.,U.S. BANK TRUST COMPANY, NATIONAL ASSOCIATION,FINANCING STATEMENT,10/15/2024,N/A,N/A,N/A
,,,2024097050,OPR/--/--,AS MILEAGE PLAN IP LTD.,U.S. BANK TRUST COMPANY, NATIONAL ASSOCIATION,FINANCING STATEMENT,10/15/2024,N/A,N/A,N/A
,,,2024101115,OPR/--/--,ASAAD PETER F,1100 OCEAN DRIVE AVALON REALTY TRUST,DEED,10/28/2024,2102,0036,N/A
,,,2024089351,OPR/--/--,ASAHARA ROBERT,HILTON RESORTS CORPORATION,DEED,9/20/2024,0050,0085,N/A
,,,2024083890,OPR/--/--,ASAMOAH JOSEPH,SOTO BENJAMIN M,TRUST,9/5/2024,4065,0052,N/A
,,,2024097827,OPR/--/--,ASB BANK LIMITED,J.P. MORGAN SECURITIES LLC,FINANCING STATEMENT CONTINUATION,10/17/2024,N/A,N/A,2014100956
,,,2024093704,OPR/--/--,ASCEND PARTNERS INC.,ABACUS FINANCE GROUP, LLC,FINANCING STATEMENT,10/3/2024,N/A,N/A,N/A
,,,2024083817,OPR/--/--,ASCENDIS PHARMA A/S,ROYALTY PHARMA DEVELOPMENT FUNDING, LLC,FINANCING STATEMENT,9/5/2024,N/A,N/A,N/A
,,,2024083818,OPR/--/--,ASCENDIS PHARMA A/S,ROYALTY PHARMA DEVELOPMENT FUNDING, LLC,FINANCING STATEMENT,9/5/2024,N/A,N/A,N/A
,,,2024083819,OPR/--/--,ASCENDIS PHARMA BONE DISEASES A/S,ROYALTY PHARMA DEVELOPMENT FUNDING, LLC,FINANCING STATEMENT,9/5/2024,N/A,N/A,N/A
,,,2024083820,OPR/--/--,ASCENDIS PHARMA BONE DISEASES A/S,ROYALTY PHARMA DEVELOPMENT FUNDING, LLC,FINANCING STATEMENT,9/5/2024,N/A,N/A,N/A
,,,2024083825,OPR/--/--,ASCENDIS PHARMA ENDOCRINOLOGY DIVISION A/S,ROYALTY PHARMA DEVELOPMENT FUNDING, LLC,FINANCING STATEMENT,9/5/2024,N/A,N/A,N/A
,,,2024083826,OPR/--/--,ASCENDIS PHARMA ENDOCRINOLOGY, INC.,Royalty Pharma Development Funding, LLC,FINANCING STATEMENT,9/5/2024,N/A,N/A,N/A
,,,2024089111,OPR/--/--,ASEPSA TRADING SA,CITIBANK, N.A.,FINANCING STATEMENT CONTINUATION,9/20/2024,N/A,N/A,2019137483
,,,2024096604,OPR/--/--,ASESA,APPLE BANK FOR SAVINGS,FINANCING STATEMENT AMENDMENT,10/15/2024,N/A,N/A,2022008578
,,,2024101900,OPR/--/--,ASESORES EN MANTENIMIENTO HIDRAULICO E INDUSTRIAL SA DE CV,CITIBANK, N.A.,FINANCING STATEMENT,10/30/2024,N/A,N/A,N/A
,,,2024083918,OPR/--/--,ASET ADJACENT OPPORTUNITIES OFFSHORE FUND, L.P.,JPMORGAN CHASE BANK, N.A.,FINANCING STATEMENT,9/5/2024,N/A,N/A,N/A
,,,2024085242,OPR/--/--,ASETTA CHRISTINE ELIZABETH,SEYMOUR SALLY,DEED,9/10/2024,2222,2020,N/A
,,,2024088809,OPR/--/--,ASF TOWER II CO-INVEST B L.P.,GLAS TRUST CORPORATION LIMITED,FINANCING STATEMENT,9/19/2024,N/A,N/A,N/A
,,,2024088808,OPR/--/--,ASF TOWER II CO-INVEST L.P.,GLAS TRUST CORPORATION LIMITED,FINANCING STATEMENT,9/19/2024,N/A,N/A,N/A
,,,2024088805,OPR/--/--,ASF VIII B L.P.,GLAS TRUST CORPORATION LIMITED,FINANCING STATEMENT,9/19/2024,N/A,N/A,N/A
,,,2024088806,OPR/--/--,ASF VIII GP LIMITED,GLAS TRUST CORPORATION LIMITED,FINANCING STATEMENT,9/19/2024,N/A,N/A,N/A
,,,2024088804,OPR/--/--,ASF VIII L.P.,GLAS TRUST CORPORATION LIMITED,FINANCING STATEMENT,9/19/2024,N/A,N/A,N/A
,,,2024101101,OPR/--/--,ASGEDOM SEBLE H,PHH MORTGAGE CORPORATION,TRUST MODIFICATION,10/28/2024,2965,0004,2007093790
,,,2024100460,OPR/--/--,ASH CAYMAN SUB (L) LLC,THE BANK OF NEW YORK MELLON TRUST COMPANY, NATIONAL ASSOCIATION,FINANCING STATEMENT,10/25/2024,N/A,N/A,2024103331
,,,2024095378,OPR/--/--,ASHBY MARIO RAY,THIRD JOHN B,TRUST,10/9/2024,4194,0034,N/A
,,,2024092602,OPR/--/--,ASHENAFI FELEKE WELDERUFAIL,REALTY TITLE SERVICES, INC,TRUST,10/1/2024,2990,0056,N/A
,,,2024091153,OPR/--/--,ASHLEY KIRK STOW LIVING TRUST,Snowden Kristine Diane,DEED,9/26/2024,0763,2011,N/A
,,,2024084255,OPR/--/--,ASHLEY WINSTON LEE,WATERS DAVID E,TRUST,9/6/2024,0049,2036,N/A
,,,2024090378,OPR/--/--,ASHOUR MAHA,SOPHER JERRY S,TRUST,9/25/2024,1061,0073,N/A
,,,2024102614,OPR/--/--,ASHRAFI MASSI,Cheung Patricia C,DEED,10/31/2024,0025,2253,N/A
,,,2024100742,OPR/--/--,ASHTON JOHN GEZA,CT CORPORATION SYSTEM,FINANCING STATEMENT,10/25/2024,N/A,N/A,N/A
,,,2024089906,OPR/--/--,ASIA ALTERNATIVES CARRY II, L.P.,JPMORGAN CHASE BANK, N.A.,FINANCING STATEMENT CONTINUATION,9/23/2024,N/A,N/A,2019106865
,,,2024089900,OPR/--/--,ASIA ALTERNATIVES CARRY II, L.P.,JPMORGAN CHASE BANK, N.A.,FINANCING STATEMENT CONTINUATION,9/23/2024,N/A,N/A,2019106865
,,,2024089902,OPR/--/--,ASIA ALTERNATIVES CARRY III, L.P.,JPMORGAN CHASE BANK, N.A.,FINANCING STATEMENT CONTINUATION,9/23/2024,N/A,N/A,2019106864
,,,2024089903,OPR/--/--,ASIA ALTERNATIVES CARRY III, L.P.,JPMORGAN CHASE BANK, N.A.,FINANCING STATEMENT CONTINUATION,9/23/2024,N/A,N/A,2019106864
,,,2024092207,OPR/--/--,ASIA ENVIRONMENTAL PARTNERS (PF1), L.P.,FIRST-CITIZENS BANK & TRUST COMPANY,FINANCING STATEMENT CONTINUATION,9/30/2024,N/A,N/A,2010011930
,,,2024093151,OPR/--/--,ASIA LITHARGE SDN. BHD.,BMO BANK N.A.,FINANCING STATEMENT,10/2/2024,N/A,N/A,N/A
,,,2024096446,OPR/--/--,ASIA REALTY FUND V (SO) AUS AIV TRUST,SUMITOMO MITSUI BANKING CORPORATION,FINANCING STATEMENT,10/15/2024,N/A,N/A,N/A
,,,2024086077,OPR/--/--,ASIAN PACIFIC NATIONAL BANK,FEDERAL RESERVE BANK OF SAN FRANCISCO,FINANCING STATEMENT,9/12/2024,N/A,N/A,N/A
,,,2024092120,OPR/--/--,ASIAN RISING TIGERS GP LTD.,FIRST-CITIZENS BANK & TRUST COMPANY,FINANCING STATEMENT CONTINUATION,9/30/2024,N/A,N/A,2015014703
,,,2024092121,OPR/--/--,ASIAN RISING TIGERS L.P.,FIRST-CITIZENS BANK & TRUST COMPANY,FINANCING STATEMENT CONTINUATION,9/30/2024,N/A,N/A,2015014702
,,,2024096712,OPR/--/--,ASK AUTOMOTIVE PRIVATE LIMITED,CITIBANK, N.A.,FINANCING STATEMENT CONTINUATION,10/15/2024,N/A,N/A,2014119946
,,,2024094929,OPR/--/--,VARGA KURTIS LEWIS,GREEN NATHAN PAUL,DEED,10/8/2024,0779,0157,N/A
,,,2024084991,OPR/--/--,ASN REVOCABLE TRUST,BREFFNIMOR, LLC,DEED,9/10/2024,0733,0043,N/A
,,,2024089068,OPR/--/--,ASOTEC AUTOMATIZACION Y SOPORTE TECNICO SOCIEDAD ANONIMA,CITIBANK, N.A.,FINANCING STATEMENT CONTINUATION,9/20/2024,N/A,N/A,2014106827
,,,2024090058,OPR/--/--,ASP (FEEDER) GLOBAL SECONDARY FUND 8 LP,GOLDMAN SACHS BANK USA,FINANCING STATEMENT,9/24/2024,N/A,N/A,N/A
,,,2024085694,OPR/--/--,ASP (FEEDER) GROWTH EQUITY FUND VII LP,BANK OF MONTREAL,FINANCING STATEMENT,9/11/2024,N/A,N/A,N/A
,,,2024085568,OPR/--/--,ASPEN JERSEY MIDCO LIMITED,KEYBANK NATIONAL ASSOCIATION,FINANCING STATEMENT CONTINUATION,9/11/2024,N/A,N/A,2020030535
,,,2024085570,OPR/--/--,ASPEN JERSEY TOPCO LIMITED,KEYBANK NATIONAL ASSOCIATION,FINANCING STATEMENT CONTINUATION,9/11/2024,N/A,N/A,2020030531
,,,2024085561,OPR/--/--,ASPEN UK BUYER LIMITED,KEYBANK NATIONAL ASSOCIATION,FINANCING STATEMENT CONTINUATION,9/11/2024,N/A,N/A,2020030537
,,,2024094983,LAND/--/--,ASPRON MARTHA,ASPRON-WILLIAMS MASSIEL E,TRANSFER ON DEATH DEED,10/8/2024,2222,2014,N/A
,,,2024083449,OPR/--/--,ASR GROUP EUROPE LIMITED,COOPERATIEVE RABOBANK U.A., NEW YORK BRANCH,FINANCING STATEMENT,9/4/2024,N/A,N/A,N/A
,,,2024085606,OPR/--/--,ASRA LIMITED,BANK OF AMERICA, N.A.,FINANCING STATEMENT,9/11/2024,N/A,N/A,2025003490
,,,2024084184,OPR/--/--,ASSELIN CHLOE,Credit Human Federal Credit Union,FINANCING STATEMENT,9/6/2024,5347,0006,N/A
,,,2024102822,OPR/--/--,ASSET BACKED FUNDING CORPORATION NIM 2005-HE1 LTD.,WELLS FARGO BANK, N.A.,FINANCING STATEMENT CONTINUATION,10/31/2024,N/A,N/A,2005059100
,,,2024094460,OPR/--/--,ASSN COMPANY,AGORA,FINANCING STATEMENT TERMINATION,10/8/2024,N/A,N/A,2022094086
,,,2024094484,OPR/--/--,ASSN COMPANY,AGORA,FINANCING STATEMENT TERMINATION,10/8/2024,N/A,N/A,2022094086
,,,2024085201,LAND/--/--,ASSOCIATES FIRST CAPITAL CORPORATION,LUCAS YVONNE FRANCES,CERTIFICATE OF SATISFACTION,9/10/2024,5199,0803,9600006681
,,,2024084625,OPR/--/--,ASSURER AT WORK LIMITED,BANK OF AMERICA, N.A.,FINANCING STATEMENT,9/9/2024,N/A,N/A,N/A
,,,2024094754,OPR/--/--,ASTATKE SOFONIAS,FIRST AMERICAN TR SERVICES OF DC LLC,TRUST,10/8/2024,1003,0147,N/A
,,,2024094753,OPR/--/--,ASTATKE SOFONIAS,ASTATKE SOFONIAS,DEED,10/8/2024,1003,0147,N/A
,,,2024094752,OPR/--/--,ASTATKE SOFONIAS,ASTATKE SOFONIAS,DEED,10/8/2024,1003,0147,N/A
,,,2024096694,OPR/--/--,ASTERA MARIS LIMITED INC.,CITIBANK, N.A.,FINANCING STATEMENT CONTINUATION,10/15/2024,N/A,N/A,2014119397
,,,2024087704,OPR/--/--,ASTIGNES ASIA RATES COMPASS FUND LTD.,J.P. MORGAN SECURITIES LLC,FINANCING STATEMENT CONTINUATION,9/17/2024,N/A,N/A,2019100816
,,,2024092008,OPR/--/--,ASTON BIDCO LIMITED,GOLDMAN SACHS BANK USA,FINANCING STATEMENT CONTINUATION,9/30/2024,N/A,N/A,2019108975
,,,2024091985,OPR/--/--,ASTON BIDCO LIMITED,MORGAN STANLEY SENIOR FUNDING, INC.,FINANCING STATEMENT CONTINUATION,9/30/2024,N/A,N/A,2019108892
,,,2024091986,OPR/--/--,ASTON BIDCO LIMITED,MORGAN STANLEY SENIOR FUNDING, INC.,FINANCING STATEMENT CONTINUATION,9/30/2024,N/A,N/A,2019108925
,,,2024092009,OPR/--/--,ASTON FINCO S.A.R.L.,GOLDMAN SACHS BANK USA,FINANCING STATEMENT CONTINUATION,9/30/2024,N/A,N/A,2019108976
,,,2024091988,OPR/--/--,ASTON FINCO S.A.R.L.,MORGAN STANLEY SENIOR FUNDING, INC.,FINANCING STATEMENT CONTINUATION,9/30/2024,N/A,N/A,2019108926
,,,2024091987,OPR/--/--,ASTON FINCO S.A.R.L.,MORGAN STANLEY SENIOR FUNDING, INC.,FINANCING STATEMENT CONTINUATION,9/30/2024,N/A,N/A,2019108893
,,,2024092010,OPR/--/--,ASTON MIDCO LIMITED,GOLDMAN SACHS BANK USA,FINANCING STATEMENT CONTINUATION,9/30/2024,N/A,N/A,2019108977
,,,2024091990,OPR/--/--,ASTON MIDCO LIMITED,MORGAN STANLEY SENIOR FUNDING, INC.,FINANCING STATEMENT CONTINUATION,9/30/2024,N/A,N/A,2019108927
,,,2024091989,OPR/--/--,ASTON MIDCO LIMITED,MORGAN STANLEY SENIOR FUNDING, INC.,FINANCING STATEMENT CONTINUATION,9/30/2024,N/A,N/A,2019108894
,,,2024086165,OPR/--/--,ATALLAH GROUP INC.,9421-6181 QUEBEC INC.,FINANCING STATEMENT,9/12/2024,N/A,N/A,N/A
,,,2024099264,OPR/--/--,ATCF II DC LLC,PHILIS DIMITRIOS,LIS PENDENS RELEASE,10/22/2024,0335,0034,2024066222
,,,2024096330,OPR/--/--,ATCF II DC, LLC,ONTARIO ROAD, LLC,LIS PENDENS RELEASE,10/11/2024,2584,0503,2024066219
,,,2024100754,OPR/--/--,ATCF II DC, LLC,4524 13TH STREET L.L.C.,LIS PENDENS RELEASE,10/25/2024,2817,0037,2024066224
,,,2024085104,OPR/--/--,ATCF II DC, LLC,BRILEY, INC.,LIS PENDENS RELEASE,9/10/2024,4547,0817,2023055508
,,,2024096328,OPR/--/--,ATCF II DC, LLC,CHAMI A REMO,LIS PENDENS RELEASE,10/11/2024,0855,0300,2024066213
,,,2024085105,OPR/--/--,ATCF II DC, LLC,OGBUOKIRI UZOMA U.,LIS PENDENS RELEASE,9/10/2024,2961,0018,2023051508
,,,2024096321,OPR/--/--,ATCF II DC, LLC,WCP FUND I LLC,LIS PENDENS RELEASE,10/11/2024,E1265,0007,2023052745
,,,2024083055,OPR/--/--,ATCF II DC, LLC,WOOD MARY A.,LIS PENDENS RELEASE,9/3/2024,2992,0080,2023051506
,,,2024092455,OPR/--/--,MainStreet Bank,Gazmur LLC,TRUST ASSIGNMENT,10/1/2024,4467,0005,2022039136
,,,2024099733,OPR/--/--,ATHENE ANNUITY AND LIFE COMPANY,Clarke James E,APPOINTMENT SUBSTITUTE TRUSTEE,10/23/2024,5290,0055,N/A
,,,2024086257,OPR/--/--,ATHYRIUM OPPORTUNITIES IV CO-INVEST 1 LP,CALLIDITAS THERAPEUTICS AB,FINANCING STATEMENT TERMINATION,9/12/2024,N/A,N/A,2023115184
,,,2024083984,OPR/--/--,ATKINSON MONICA S,KESECKER KEVIN,TRUST,9/5/2024,0651,0067,N/A
,,,2024093905,OPR/--/--,ATLANTIC CAPITAL SERVICES,DAROFF JOHN B,TRUST,10/3/2024,3210,0094,N/A
,,,2024094784,OPR/--/--,ATLANTIC COAST MORTGAGE LLC,WARD CARRIE M,APPOINTMENT SUBSTITUTE TRUSTEE,10/8/2024,2940,2002,N/A
,,,2024091119,OPR/--/--,MORTGAGE ELECTRONIC REGISTRATION SYSTEMS INC,SERVIS ONE, INC,TRUST ASSIGNMENT,9/26/2024,1028,0193,2020124095
,,,2024098002,OPR/--/--,MORTGAGE ELECTRONIC REGISTRATION SYSTEMS INC,DAVIS CHARLES NATHAN JR,CERTIFICATE OF SATISFACTION,10/18/2024,3565,2107,2023057357
,,,2024103126,OPR/--/--,MORTGAGE ELECTRONIC REGISTRATION SYSTEMS INC,DEGENARO STEPHEN M,CERTIFICATE OF SATISFACTION,11/1/2024,1053,0098,2020106272
,,,2024096118,OPR/--/--,MORTGAGE ELECTRONIC REGISTRATION SYSTEMS INC,DESAI PRASUN N,CERTIFICATE OF SATISFACTION,10/11/2024,4055,0240,2012131304
,,,2024099434,OPR/--/--,ATLANTIC COAST MORTGAGE LLC,GILL GARY F,CERTIFICATE OF SATISFACTION,10/22/2024,0180,0084,2024077518
,,,2024091562,OPR/--/--,MORTGAGE ELECTRONIC REGISTRATION SYSTEMS INC,GRANT ANNA LAURA,CERTIFICATE OF SATISFACTION,9/27/2024,2692,0051,2019128376
,,,2024086795,OPR/--/--,ATLANTIC COAST MORTGAGE LLC,JOHNSTON ZACHARY C,CERTIFICATE OF SATISFACTION,9/16/2024,3816,2001,2021029415
,,,2024101614,LAND/--/--,MORTGAGE ELECTRONIC REGISTRATION SYSTEMS INC,HILL JOHN S,CERTIFICATE OF SATISFACTION,10/29/2024,1601,0007,2022069537
,,,2024095327,OPR/--/--,MORTGAGE ELECTRONIC REGISTRATION SYSTEMS INC,JOLLIFFE DEAN MITCHELL,CERTIFICATE OF SATISFACTION,10/9/2024,0237,0130,2014111856
,,,2024085347,OPR/--/--,MORTGAGE ELECTRONIC REGISTRATION SYSTEMS INC,JPMORGAN CHASE BANK NATIONAL ASSOCIATION,TRUST ASSIGNMENT,9/10/2024,5564,0823,2019129521
,,,2024092026,OPR/--/--,MORTGAGE ELECTRONIC REGISTRATION SYSTEMS INC,OHLSEN ERIC ANDREW,CERTIFICATE OF SATISFACTION,9/30/2024,4319,0052,2019080403
,,,2024086545,OPR/--/--,MORTGAGE ELECTRONIC REGISTRATION SYSTEMS INC,PORTER DAVID WAYNE,CERTIFICATE OF SATISFACTION,9/13/2024,2571,2095,2021011857
,,,2024098952,OPR/--/--,MORTGAGE ELECTRONIC REGISTRATION SYSTEMS INC,POWERS KATHERINE HEALEY,CERTIFICATE OF SATISFACTION,10/22/2024,2567,2112,2023112345
,,,2024099581,OPR/--/--,MORTGAGE ELECTRONIC REGISTRATION SYSTEMS INC,SCHILLHAHN KAY ELAINE,CERTIFICATE OF SATISFACTION,10/23/2024,1368,0059,2020108523
,,,2024092624,OPR/--/--,ATLANTIC COAST MORTGAGE, LLC,BERNIER CAROLYN M,CERTIFICATE OF SATISFACTION,10/1/2024,1418,2023,2007128838
,,,2024087808,OPR/--/--,ATLANTIC COAST MORTGAGE, LLC,DESAI MIRA,CERTIFICATE OF SATISFACTION,9/18/2024,0517,2677,2021080229
,,,2024082964,OPR/--/--,ATLANTIC COAST MORTGAGE, LLC,GREENE REGINA D,CERTIFICATE OF SATISFACTION,9/3/2024,2868,0147,9400071649
,,,2024100978,OPR/--/--,MORTGAGE ELECTRONIC REGISTRATION SYSTEMS, INC.,HARESIGN DAVID T,CERTIFICATE OF SATISFACTION,10/28/2024,2037,0024,2021041139
,,,2024096783,OPR/--/--,MORTGAGE ELECTRONIC REGISTRATION SYSTEMS, INC.,HOWARD MARC M,CERTIFICATE OF SATISFACTION,10/15/2024,1601,0007,2024008611
,,,2024082465,OPR/--/--,MORTGAGE ELECTRONIC REGISTRATION SYSTEMS, INC.,KAHOE ANNA,CERTIFICATE OF SATISFACTION,9/3/2024,0312,2002,2020135672
,,,2024097720,OPR/--/--,ATLANTIC COAST MORTGAGE, LLC,MCBURNEY MATTHEW J,CERTIFICATE OF SATISFACTION,10/17/2024,0341,0051,2012029464
,,,2024085109,OPR/--/--,ATLANTIC COAST MORTGAGE, LLC,STRAKHOV ANDREY,CERTIFICATE OF SATISFACTION,9/10/2024,1301,1199,2020143190
,,,2024091747,OPR/--/--,MORTGAGE ELECTRONIC REGISTRATION SYSTEMS INC,SOMMERS MARK S,CERTIFICATE OF SATISFACTION,9/27/2024,2238,0008,2012113798
,,,2024085172,LAND/--/--,MORTGAGE ELECTRONIC REGISTRATION SYSTEMS INC,LUSTBADER STEVEN,CERTIFICATE OF SATISFACTION,9/10/2024,0133,2071,2012037896
,,,2024097443,OPR/--/--,ATLANTIC FIR COMPANY,PACIFIC FIR COMPANY,FINANCING STATEMENT CONTINUATION,10/16/2024,N/A,N/A,2019132198
,,,2024093847,OPR/--/--,ATLANTIC UNION BANK,RANNICK THOMAS A,CERTIFICATE OF SATISFACTION,10/3/2024,1445,0067,2018031023
,,,2024087368,OPR/--/--,Berman Michael,Sherman Thomas M,ASSUMPTION AGREEMENT,9/17/2024,1060,0015,2005185172
,,,2024087483,OPR/--/--,ATLANTIS EXPRESS LIMITED,UBS SWITZERLAND AG,FINANCING STATEMENT AMENDMENT,9/17/2024,N/A,N/A,2024086197
,,,2024086197,OPR/--/--,ATLANTIS EXPRESS LIMITED,UBS SWITZERLAND AG,FINANCING STATEMENT,9/12/2024,N/A,N/A,2024087483
,,,2024096844,OPR/--/--,ATLANTIS FILM GMBH,SCREEN ACTORS GUILD-AMERICA FEDERATION OF TELEVISION AND RADIO ARTIST,FINANCING STATEMENT CONTINUATION,10/15/2024,N/A,N/A,9900018654
,,,2024094819,OPR/--/--,ATLAS BREW WORKS LLC,FIRST NATIONAL BANK OF PENNSYLVANIA,FINANCING STATEMENT CONTINUATION,10/8/2024,N/A,N/A,2015014935
,,,2024092087,OPR/--/--,ATLAS ENHANCED PORTABLE ALPHA, LTD.,NORDEA BANK ABP, NEW YORK BRANCH,FINANCING STATEMENT AMENDMENT,9/30/2024,N/A,N/A,2023084592
,,,2024089059,OPR/--/--,UNITED STATES SENATE FEDERAL CREDIT UNION,THEOLOGOU DIANA C,APPOINTMENT SUBSTITUTE TRUSTEE,9/20/2024,6070,0052,N/A
,,,2024088259,OPR/--/--,ATLAS SENIOR LOAN FUND XV, LTD.,U.S. BANK NATIONAL ASSOCIATION,FINANCING STATEMENT AMENDMENT,9/19/2024,N/A,N/A,2019116808
,,,2024088434,OPR/--/--,ATLAS SENIOR LOAN FUND XV, LTD.,U.S. BANK TRUST COMPANY, NATIONAL ASSOCIATION,FINANCING STATEMENT CONTINUATION,9/19/2024,N/A,N/A,2019116808
,,,2024084869,OPR/--/--,ATRIUM PRODUCTIONS KFT.,APERTURE MEDIA PARTNERS LLC,FINANCING STATEMENT,9/10/2024,N/A,N/A,N/A
,,,2024100892,OPR/--/--,ATRIUM PRODUCTIONS KFT.,MUFG BANK, LTD.,FINANCING STATEMENT,10/28/2024,N/A,N/A,N/A
,,,2024088070,OPR/--/--,ATRIUM PRODUCTIONS KFT.,PMP MUZZLE LLC,FINANCING STATEMENT,9/18/2024,N/A,N/A,N/A
,,,2024097446,OPR/--/--,ATSBAHA SEGHEN B,TRAN CUONG,TRUST,10/16/2024,3648,0839,N/A
,,,2024101931,OPR/--/--,ATSG CANADA HOLDINGS LTD.,BLUE TORCH FINANCE LLC,FINANCING STATEMENT,10/30/2024,N/A,N/A,N/A
,,,2024097201,OPR/--/--,ATTERMANN JASON,ATTERMANN JASON HILLEL,DEED,10/16/2024,2887,0177,N/A
,,,2024103221,OPR/--/--,ATTEST TECHNOLOGIES LIMITED,FIRST-CITIZENS BANK & TRUST COMPANY,FINANCING STATEMENT CONTINUATION,11/1/2024,N/A,N/A,2020010449
,,,2024100355,OPR/--/--,ATTIAS PROPERTY GROUP, LLC,3112 MOUNT PLEASANT LLC,DEED,10/24/2024,2596,0638,N/A
,,,2024098606,OPR/--/--,AU-DUONG VIVIAN,ANDERSON KEVIN,TRUST,10/21/2024,5561,0037,2024107513
,,,2024103303,OPR/--/--,AUBERT CASSANDRA M KLOSTERMAN,WATERS DAVID E,TRUST,11/1/2024,3148,0125,N/A
,,,2024091227,OPR/--/--,AUCOIN JESSICA RAE,BRITTON AMELIA,DEED,9/26/2024,4547,2039,N/A
,,,2024092203,OPR/--/--,AUDA ASIA II GP LTD.,FIRST-CITIZENS BANK & TRUST COMPANY,FINANCING STATEMENT CONTINUATION,9/30/2024,N/A,N/A,2015014699
,,,2024092176,OPR/--/--,AUDA ASIA II L.P.,FIRST-CITIZENS BANK & TRUST COMPANY,FINANCING STATEMENT CONTINUATION,9/30/2024,N/A,N/A,2015014698
,,,2024092177,OPR/--/--,AUDA CAPITAL V-EUROPE L.P.,FIRST-CITIZENS BANK & TRUST COMPANY,FINANCING STATEMENT CONTINUATION,9/30/2024,N/A,N/A,2015014692
,,,2024092181,OPR/--/--,AUDA CAPITAL V-EUROPE LTD.,FIRST-CITIZENS BANK & TRUST COMPANY,FINANCING STATEMENT CONTINUATION,9/30/2024,N/A,N/A,2015014688
,,,2024092528,OPR/--/--,AUDA CAPITAL V-U.S. L.P.,FIRST-CITIZENS BANK & TRUST COMPANY,FINANCING STATEMENT CONTINUATION,10/1/2024,N/A,N/A,2015014683
,,,2024092638,OPR/--/--,AUDA CAPITAL V-U.S. LTD.,FIRST-CITIZENS BANK & TRUST COMPANY,FINANCING STATEMENT CONTINUATION,10/1/2024,N/A,N/A,2015014684
,,,2024092531,OPR/--/--,AUDA CAPITAL VI GP LTD,FIRST-CITIZENS BANK & TRUST COMPANY,FINANCING STATEMENT CONTINUATION,10/1/2024,N/A,N/A,2015014686
,,,2024092182,OPR/--/--,AUDA CAPITAL VI GP LTD.,FIRST-CITIZENS BANK & TRUST COMPANY,FINANCING STATEMENT CONTINUATION,9/30/2024,N/A,N/A,2015014687
,,,2024092530,OPR/--/--,AUDA CAPITAL VI-EUROPE L.P.,FIRST-CITIZENS BANK & TRUST COMPANY,FINANCING STATEMENT CONTINUATION,10/1/2024,N/A,N/A,2015014685
,,,2024092500,OPR/--/--,AUDA CAPITAL VI-U.S. L.P.,FIRST-CITIZENS BANK TRUST COMPANY,FINANCING STATEMENT CONTINUATION,10/1/2024,N/A,N/A,2015014689
,,,2024092635,OPR/--/--,AUDA SECONDARY FUND II L.P.,FIRST-CITIZENS BANK & TRUST COMPANY,FINANCING STATEMENT CONTINUATION,10/1/2024,N/A,N/A,2015014677
,,,2024092632,OPR/--/--,AUDA SECONDARY FUND III LP,FIRST-CITIZENS BANK & TRUST COMPANY,FINANCING STATEMENT CONTINUATION,10/1/2024,N/A,N/A,2015014673
,,,2024092631,OPR/--/--,AUDA SECONDARY II GP LTD.,FIRST-CITIZENS BANK & TRUST COMPANY,FINANCING STATEMENT CONTINUATION,10/1/2024,N/A,N/A,2015014678
,,,2024092630,OPR/--/--,AUDA SECONDARY III GP LTD,FIRST-CITIZENS BANK & TRUST COMPANY,FINANCING STATEMENT CONTINUATION,10/1/2024,N/A,N/A,2015014672
,,,2024089939,OPR/--/--,AUDA TIME LLC,OCAMPO MARIA DE JESUS BUENAVENTURA,DEED,9/23/2024,6149,0030,N/A
,,,2024086062,OPR/--/--,AUDAX CREDIT OPPORTUNITIES OFFSHORE LTD.,WELLS FARGO BANK, NATIONAL ASSOCIATION,FINANCING STATEMENT,9/12/2024,N/A,N/A,N/A
,,,2024086063,OPR/--/--,AUDAX CREDIT OPPORTUNITIES OFFSHORE LTD.,WELLS FARGO BANK, NATIONAL ASSOCIATION,FINANCING STATEMENT CONTINUATION,9/12/2024,N/A,N/A,2019126574
,,,2024085530,OPR/--/--,AUDAX DIRECT LENDING SOLUTIONS FUND II B- 1 (LUX) FEEDER, SCSP,GOLDMAN SACHS BANK USA,FINANCING STATEMENT,9/11/2024,N/A,N/A,N/A
,,,2024085526,OPR/--/--,AUDAX DIRECT LENDING SOLUTIONS FUND II B-1 FEEDER, LLC,GOLDMAN SACHS BANK USA,FINANCING STATEMENT,9/11/2024,N/A,N/A,N/A
,,,2024086221,OPR/--/--,AUDAX DIRECT LENDING SOLUTIONS FUND II B-1 FEEDER, LLC,Goldman Sachs Bank USA,FINANCING STATEMENT,9/12/2024,N/A,N/A,N/A
,,,2024085513,OPR/--/--,AUDAX DIRECT LENDING SOLUTIONS FUND II-B FEEDER, LLC,GOLDMAN SACHS BANK USA,FINANCING STATEMENT,9/11/2024,N/A,N/A,N/A
,,,2024086300,OPR/--/--,WARD-AUDENA ERICKA Q,FINGERMAN ADAM,TRUST,9/12/2024,3810,0061,N/A
,,,2024084382,OPR/--/--,AUDETTE MICHAELA SUSAN,SPRIGGS ERNEST,TRUST,9/6/2024,2068,0091,N/A
,,,2024102278,OPR/--/--,AUGMEDIX BD LIMITED,COMMURE, INC.,FINANCING STATEMENT,10/30/2024,N/A,N/A,N/A
,,,2024102282,OPR/--/--,AUGMEDIX SOLUTIONS, PVT LIMITED,COMMURE, INC.,FINANCING STATEMENT,10/31/2024,N/A,N/A,N/A
,,,2024096080,OPR/--/--,U.S. BANK NATIONAL ASSOCIATION,EISENBERG STEVEN K,APPOINTMENT SUBSTITUTE TRUSTEE,10/11/2024,0514,2145,N/A
,,,2024084821,OPR/--/--,AURELIUS IV UK ACQUICO SEVEN LIMITED,THE BODY SHOP INTERNATIONAL LIMITED,FINANCING STATEMENT TERMINATION,9/9/2024,N/A,N/A,2024000503
,,,2024096536,OPR/--/--,AURORA FINANCIAL LLC,DEJELO CHRIS,CERTIFICATE OF SATISFACTION,10/15/2024,4327,0832,2020083647
,,,2024097166,OPR/--/--,AURORA FINANCIAL, LLC,BATRA BINEESH SIMI,CERTIFICATE OF SATISFACTION,10/16/2024,2566,0836,2019062090
,,,2024091650,OPR/--/--,MORTGAGE ELECTRONIC REGISTRATION SYSTEMS INC,DIVIS JACK,CERTIFICATE OF SATISFACTION,9/27/2024,3031,0164,2011106642
,,,2024102137,OPR/--/--,AUSTIN CARNELIA L,OLD REPUBLIC TITLE INFORMATION SERVICES,TRUST,10/30/2024,1102,0093,N/A
,,,2024092671,OPR/--/--,AUSTIN LLC,BANK OF MONTREAL,FINANCING STATEMENT,10/1/2024,N/A,N/A,N/A
,,,2024087056,OPR/--/--,AUSTIN WENDY M,HILTON RESORTS CORPORATION,DEED,9/16/2024,0050,2002,N/A
,,,2024101274,OPR/--/--,AUSTRALIA AND NEW ZEALAND BANKING GROUP LIMITED,FEDERAL RESERVE BANK OF NEW YORK,FINANCING STATEMENT CONTINUATION,10/28/2024,N/A,N/A,2010016115
